courseCode,courseName,major
GMBA8103 ," Improve Yourself, Always", Management  
GMBA8104 , Become a Global Citizen, Management  
GMBA8121 , Advise, Management  
GMBA8122 , Be Curious, Management  
GMBA8123 , Applied Immersion 1, Management  
GMBA8124 , Applied Immersion 2, Management  
GRMN1010 , I German Studies 1," Media, Communications, Creative Arts, Language and Literature "
GRMN1020 , I German Studies 2," Media, Communications, Creative Arts, Language and Literature "
GRMN1210 , C German Studies 3," Media, Communications, Creative Arts, Language and Literature "
GRMN1220 , C German Studies 4," Media, Communications, Creative Arts, Language and Literature "
GRMN2010 , I German Studies 3," Media, Communications, Creative Arts, Language and Literature "
GRMN2020 , I German Studies 4," Media, Communications, Creative Arts, Language and Literature "
GRMN2095 , Reading for Special Purposes 1," Media, Communications, Creative Arts, Language and Literature "
GRMN2210 , C German Studies 5," Media, Communications, Creative Arts, Language and Literature "
GRMN2220 , C German Studies 6," Media, Communications, Creative Arts, Language and Literature "
GRMN3010 , I German Studies 5," Media, Communications, Creative Arts, Language and Literature "
GRMN3020 , I German Studies 6," Media, Communications, Creative Arts, Language and Literature "
HLTH2000 , Contemporary Health Issues,Owned at Faculty level 
HLTH2110 , Clinical Epidemiology and Biostatistics for Health Sciences, Chiropractic  
HLTH2301 , Principles in Health and Disease 1, Chiropractic  
HLTH3050 , Health Placement,Owned at Faculty level 
HLTH3100 , Health Promotion,Owned at Faculty level 
HLTH3140 ," Radiographic Physics, Practice and Protection", Chiropractic  
HLTH3302 , Principles in Health and Disease 2, Chiropractic  
HLTH3303 , Principles in Health and Disease 3, Chiropractic  
HLTH3500 ," Legal, Ethical and Policy Directions in Human Sciences",Owned at Faculty level 
HLTH7900 , Research Frontiers in Anatomy and Chiropractic, Chiropractic  
HLTH7901 , Introduction to Clinical Research, Chiropractic  
HLTH7902 , Introduction to Knowledge Translation in Clinical Practice, Chiropractic  
HSYP8003 , Applied Research Methodologies in Health,Owned at Faculty level 
HSYP8004 , Public Health Informatics,Owned at Faculty level 
HSYP8005 , Infectious Disease Epidemiology,Owned at Faculty level 
HSYP8006 , Inclusive Health,Owned at Faculty level 
HSYP8007 , Program Planning and Evaluation in Health Promotion,Owned at Faculty level 
HSYP8008 , Global Nutrition and Food Security,Owned at Faculty level 
HSYP8100 , Foundations of Public Health,Owned at Faculty level 
HSYP8101 , Introduction to Epidemiology and Biostatistics,Owned at Faculty level 
HSYP8102 , Determinants of Health,Owned at Faculty level 
HSYP8103 , Health Law and Economics,Owned at Faculty level 
HSYP8104 , Disease Prevention and Health Promotion,Owned at Faculty level 
HSYP8105 , Systems Science in Healthcare,Owned at Faculty level 
HSYP8106 ," Innovation in Leadership, Teamwork and Advocacy",Owned at Faculty level 
HSYP8107 , Public Health Capstone,Owned at Faculty level 
HSYP8211 , Professional Practice,Owned at Faculty level 
HSYP8990 , Health Systems and Populations,Owned at Faculty level 
INDG7000 , Research Theme 6, Indigenous Studies  
INDG7001 , Research Ethics in Indigenous Australian Contexts, Indigenous Studies  
INED8001 , History of Indigenous Education, Indigenous Studies  
INED8002 , Sociology of Education, Indigenous Studies  
INED8010 , Indigenous Languages and Teaching, Indigenous Studies  
INED8020 , Research Methods in Indigenous Education, Indigenous Studies  
INED8022 , Indigenous Education Capstone Research Project, Indigenous Studies  
INED8030 ," Politics, Power and Indigenous Education", Indigenous Studies  
INED8040 , Global Indigenous Education, Indigenous Studies  
INED8050 , Trauma Informed Education, Indigenous Studies  
INTS1000 , Language and Communication: Cultural Contexts," Media, Communications, Creative Arts, Language and Literature "
INTS1015 , Intercultural Language Project 1," Media, Communications, Creative Arts, Language and Literature "
INTS1030 ,Country Cultural Studies," Media, Communications, Creative Arts, Language and Literature "
INTS2001 , Language in Use," Media, Communications, Creative Arts, Language and Literature "
INTS2015 , Intercultural Language Project 2," Media, Communications, Creative Arts, Language and Literature "
INTS2020 ," Citizenship, Borders and Transnationalism"," Media, Communications, Creative Arts, Language and Literature "
INTS2090 ,Country Cultural Studies," Media, Communications, Creative Arts, Language and Literature "
INTS3000 , International Studies Intercultural Program," Media, Communications, Creative Arts, Language and Literature "
INTS3010 , International Studies Project," Media, Communications, Creative Arts, Language and Literature "
INTS3013 ,Country Study 2," Media, Communications, Creative Arts, Language and Literature "
INTS3015 , Intercultural Language Project 3," Media, Communications, Creative Arts, Language and Literature "
INTS3016 ,Country Study 1," Media, Communications, Creative Arts, Language and Literature "
INTS3020 ," Language, Literature, Translation: Intercultural Perspectives"," Media, Communications, Creative Arts, Language and Literature "
INTS3030 , Visualising Cultures," Media, Communications, Creative Arts, Language and Literature "
INTS3040 , Global Issues," Media, Communications, Creative Arts, Language and Literature "
INTS3050 , International Studies Internship," Media, Communications, Creative Arts, Language and Literature "
INTS3080 ,Country Study 3," Media, Communications, Creative Arts, Language and Literature "
INTS3090 ,Country Study 4," Media, Communications, Creative Arts, Language and Literature "
INTS6000 , Reading Academic Texts in German I," Media, Communications, Creative Arts, Language and Literature "
INTS7000 ," Critique in Language, Literature and Culture Studies"," Media, Communications, Creative Arts, Language and Literature "
INTS7001 , Special Topics in International Studies: Languages and Cultures," Media, Communications, Creative Arts, Language and Literature "
INTS8990 , International Studies," Media, Communications, Creative Arts, Language and Literature "
ITAL1010 , I Italian Studies 1," Media, Communications, Creative Arts, Language and Literature "
ITAL1020 , I Italian Studies 2," Media, Communications, Creative Arts, Language and Literature "
ITAL2010 , I Italian Studies 3," Media, Communications, Creative Arts, Language and Literature "
ITAL2020 , I Italian Studies 4," Media, Communications, Creative Arts, Language and Literature "
ITAL3010 , I Italian Studies 5," Media, Communications, Creative Arts, Language and Literature "
ITAL3020 , I Italian Studies 6," Media, Communications, Creative Arts, Language and Literature "
JPNS1010 , I Japanese Studies 1," Media, Communications, Creative Arts, Language and Literature "
JPNS1020 , I Japanese Studies 2," Media, Communications, Creative Arts, Language and Literature "
JPNS1024 , Japanese Contemporary Culture," Media, Communications, Creative Arts, Language and Literature "
JPNS1210 , C Japanese Studies 3," Media, Communications, Creative Arts, Language and Literature "
JPNS1220 , C Japanese Studies 4," Media, Communications, Creative Arts, Language and Literature "
JPNS2010 , I Japanese Studies 3," Media, Communications, Creative Arts, Language and Literature "
JPNS2020 , I Japanese Studies 4," Media, Communications, Creative Arts, Language and Literature "
JPNS2021 , Social Issues in Contemporary Japan," Media, Communications, Creative Arts, Language and Literature "
JPNS2022 , Exploring Japanese Literature," Media, Communications, Creative Arts, Language and Literature "
JPNS2210 , C Japanese Studies 5," Media, Communications, Creative Arts, Language and Literature "
JPNS2220 , C Japanese Studies 6," Media, Communications, Creative Arts, Language and Literature "
JPNS3010 , I Japanese Studies 5," Media, Communications, Creative Arts, Language and Literature "
JPNS3020 , I Japanese Studies 6," Media, Communications, Creative Arts, Language and Literature "
JPNS3021 , Social Issues in Contemporary Japan ," Media, Communications, Creative Arts, Language and Literature "
JPNS3050 , Japanese Studies in Action," Media, Communications, Creative Arts, Language and Literature "
JPNX1010 , Introductory Japanese I," Media, Communications, Creative Arts, Language and Literature "
JPNX1020 , Introductory Japanese II," Media, Communications, Creative Arts, Language and Literature "
LAWS1000 , Foundations of Law,Macquarie Law School  
LAWS1010 , Introduction to Law and Social Justice,Macquarie Law School  
LAWS1100 ," Law, Lawyers and Society",Macquarie Law School  
LAWS1200 , Contracts,Macquarie Law School  
LAWS1300 , Criminal Justice,Macquarie Law School  
LAWS2000 , International Law,Macquarie Law School  
LAWS2050 ," Crime, Policy and Governance",Macquarie Law School  
LAWS2060 , The Politics of Human Rights Law,Macquarie Law School  
LAWS2100 , Jurisprudence,Macquarie Law School  
LAWS2200 , Property Law,Macquarie Law School  
LAWS2300 , Business Organisations,Macquarie Law School  
LAWS2400 , Torts,Macquarie Law School  
LAWS2500 , Equity and Trusts,Macquarie Law School  
LAWS5007 , Employment and Labour Law ,Macquarie Law School  
LAWS5010 , Trade Law ,Macquarie Law School  
LAWS5020 , Family Law,Macquarie Law School  
LAWS5021 , Foundations of Commercial Law,Macquarie Law School  
LAWS5023 , Intellectual Property Law,Macquarie Law School  
LAWS5028 , Competition Law,Macquarie Law School  
LAWS5029 , Law and Technology,Macquarie Law School  
LAWS5030 , Law Moots and Competitions,Macquarie Law School  
LAWS5036 , Modern Corporate Governance,Macquarie Law School  
LAWS5040 , Environmental Planning Law,Macquarie Law School  
LAWS5043 , Climate Change Law,Macquarie Law School  
LAWS5048 , Animal Law,Macquarie Law School  
LAWS5051 , Independent Professional Placement,Macquarie Law School  
LAWS5053 , Taxation,Macquarie Law School  
LAWS5056 , Succession,Macquarie Law School  
LAWS5057 , Conflict of Laws,Macquarie Law School  
LAWS5060 , Environmental Law,Macquarie Law School  
LAWS5065 , Dispute Management and Resolution,Macquarie Law School  
LAWS5069 , Energy and Natural Resources Law,Macquarie Law School  
LAWS5071 , Health Law and Ethics,Macquarie Law School  
LAWS5078 , Social Justice and Legal Tech Clinics,Macquarie Law School  
LAWS5079 , Refugees and Migration,Macquarie Law School  
LAWS5080 , Human Rights and Moral Dilemmas,Macquarie Law School  
LAWS5082 , Insolvency Law,Macquarie Law School  
LAWS5084 , Media Law,Macquarie Law School  
LAWS5086 , Law of the Sea,Macquarie Law School  
LAWS5087 , Law of Armed Conflict,Macquarie Law School  
LAWS5301 , International Law Exchange 1,Macquarie Law School  
LAWS5302 , International Law Exchange 2,Macquarie Law School  
LAWS5303 , International Law Exchange 3,Macquarie Law School  
LAWS5304 , International Law Exchange 4,Macquarie Law School  
LAWS5920 , Legal Research Project Part A,Macquarie Law School  
LAWS5930 , Legal Research Project Part B,Macquarie Law School  
LAWS5940 , Applied Legal Research,Macquarie Law School  
LAWS8000 , Law Moots and Competitions ,Macquarie Law School  
LAWS8001 , Foundations of Law,Macquarie Law School  
LAWS8002 , Criminal Justice and Public Policy,Macquarie Law School  
LAWS8005 , Theories of Law and Justice,Macquarie Law School  
LAWS8006 , Applied Legal Ethics,Macquarie Law School  
LAWS8009 , Property Law,Macquarie Law School  
LAWS8010 , Equity and Trusts,Macquarie Law School  
LAWS8011 , Company Law,Macquarie Law School  
LAWS8013 , Civil and Criminal Procedure,Macquarie Law School  
LAWS8014 , Evidence,Macquarie Law School  
LAWS8021 , Health Law,Macquarie Law School  
LAWS8022 , Family Law,Macquarie Law School  
LAWS8023 , Commercial Law,Macquarie Law School  
LAWS8024 , Intellectual Property Law,Macquarie Law School  
LAWS8025 , Taxation Law,Macquarie Law School  
LAWS8026 ,Discrimination Law,Macquarie Law School  
LAWS8027 , Remedies,Macquarie Law School  
LAWS8029 , Succession,Macquarie Law School  
LAWS8030 , Contracts,Macquarie Law School  
LAWS8036 , Insolvency Law,Macquarie Law School  
LAWS8037 , Refugees and Migration Law,Macquarie Law School  
LAWS8040 , Torts,Macquarie Law School  
LAWS8050 , Corporate Governance Law ,Macquarie Law School  
LAWS8051 , Climate Change Law,Macquarie Law School  
LAWS8052 , Trade and Environment Law,Macquarie Law School  
LAWS8055 , Environmental Law and Sustainable Development,Macquarie Law School  
LAWS8060 , Energy and Natural Resources Law ,Macquarie Law School  
LAWS8061 , Environmental Planning Law,Macquarie Law School  
LAWS8066 , Indigenous Peoples and the Law,Macquarie Law School  
LAWS8068 , Law and Technology ,Macquarie Law School  
LAWS8070 , Constitutional Law,Macquarie Law School  
LAWS8080 , Administrative Law,Macquarie Law School  
LAWS8087 , International Human Rights Law,Macquarie Law School  
LAWS8089 , Trade Law ,Macquarie Law School  
LAWS8092 , Law of the Sea,Macquarie Law School  
LAWS8094 , Human Rights and Moral Dilemmas,Macquarie Law School  
LAWS8095 , Legal Research Dissertation,Macquarie Law School  
LAWS8097 , Media Law and Culture,Macquarie Law School  
LAWS8098 , International Commercial Law,Macquarie Law School  
LAWS8099 , Professional and Community Engagement,Macquarie Law School  
LAWS8100 , Professional Skills and Practice,Macquarie Law School  
LAWS8990 , Law,Owned at Faculty level 
LING1109 ," Language, Culture and Communication", Linguistics  
LING1111 , Language: Its Structure and Use, Linguistics  
LING1120 , Exploring English, Linguistics  
LING1121 , Language Myths and Realities, Linguistics  
"""LING2213 "," Australia's Indigenous Languages""", Linguistics  
LING2214 , Introduction to Psycholinguistics, Linguistics  
LING2217 , Introductory Phonetics and Phonology, Linguistics  
LING2218 , Grammar and Meaning, Linguistics  
LING2219 , Introduction to Sociolinguistics, Linguistics  
LING2220 , Syntax, Linguistics  
LING2293 , Creating and Editing Professional Genres, Linguistics  
LING3300 , Linguistic Theory and Practice, Linguistics  
LING3381 , Language and Culture in the Workplace, Linguistics  
LING3383 , Morphosyntax: The Meaningful Components of Words, Linguistics  
LING3384 , Child Language Acquisition: Morphology and Syntax, Linguistics  
LING3385 , Second Language Teaching and Learning, Linguistics  
LING3386 , Multilingualism, Linguistics  
LING3388 , Accessible and Inclusive Communication, Linguistics  
LING3390 , Phonological Analysis, Linguistics  
LING3391 , Forensic Linguistics, Linguistics  
LING7385 , Advanced Topics in Second Language Teaching and Learning, Linguistics  
LING7700 ," Advanced Topics in Grammar, Meaning and Discourse", Linguistics  
LING7701 , Modern Theories of Linguistics in the History of Human Sciences, Linguistics  
LING7702 , Corpus Linguistics, Linguistics  
LING7780 , Advanced Topics in Language in Interaction, Linguistics  
LING7784 , Syntax and Semantics in Child Language, Linguistics  
LING7793 , Advanced Topics in Australia's Indigenous Languages, Linguistics  
LING8800 , Accessible Communication, Linguistics  
LING8990 , Linguistics, Linguistics  
LINX1300 , Placenames in the Modern World, Linguistics  
LINX2217 , Introduction to Phonetics and Phonology, Linguistics  
LYMP8000 , Lymphoedema in Context,Owned at Faculty level 
LYMP8001 , Principles of Lymphoedema Management,Owned at Faculty level 
LYMP8002 , Contemporary Evidence in Lymphoedema Management,Owned at Faculty level 
LYMP8003 , Lymphoedema Practice for the Upper Limb and Breast,Owned at Faculty level 
LYMP8004 , Lymphoedema Practice for the Lower Limb and Genital Region,Owned at Faculty level 
LYMP8005 , Lymphoedema Practice for the Head and Neck Region,Owned at Faculty level 
LYMP8006 , Professional Practice in Lymphoedema Management,Owned at Faculty level 
LYMP8007 , Management of Children with Lymphoedema ,Owned at Faculty level 
LYMP8008 , Management of Wounds in People with Chronic Oedemas ,Owned at Faculty level 
LYMP8009 , Wellness During Cancer Treatment and Beyond,Owned at Faculty level 
LYMP8010 , Survivorship: Living with Lymphoedema ,Owned at Faculty level 
LYMP8011 , Comprehensive Interprofessional Lymphoedema Models of Care ,Owned at Faculty level 
MATH1000 , Introduction to Mathematical Modelling, Mathematics and Statistics  
MATH1007 , Discrete Mathematics I, Mathematics and Statistics  
MATH1010 , Calculus and Linear Algebra I, Mathematics and Statistics  
MATH1015 , Calculus and Linear Algebra I (Advanced), Mathematics and Statistics  
MATH1020 , Calculus and Linear Algebra II, Mathematics and Statistics  
MATH1025 , Calculus and Linear Algebra II (Advanced), Mathematics and Statistics  
MATH2010 , Calculus and Linear Algebra III, Mathematics and Statistics  
MATH2020 , Vector Calculus and Complex Analysis, Mathematics and Statistics  
MATH2055 , Engineering Mathematics II, Mathematics and Statistics  
MATH2110 , Mathematical Modelling and Differential Equations, Mathematics and Statistics  
MATH2210 , Pure Mathematics II, Mathematics and Statistics  
MATH2907 , Discrete Mathematics II, Mathematics and Statistics  
MATH3599 , Professional Practice for Mathematical Sciences, Mathematics and Statistics  
MATH3900 , Geometry and Topology, Mathematics and Statistics  
MATH3902 , Nonlinear Dynamics and Chaos, Mathematics and Statistics  
MATH3905 , Mathematical Methods, Mathematics and Statistics  
MATH3906 , Partial Differential Equations, Mathematics and Statistics  
MATH3907 , Algebra IIIA, Mathematics and Statistics  
MATH3909 , Real and Functional Analysis, Mathematics and Statistics  
MATH3918 , Mathematics III Advanced, Mathematics and Statistics  
MATH6904 , Mathematical Modelling, Mathematics and Statistics  
MATH7900 , Research Frontiers in Mathematics, Mathematics and Statistics  
MATH7901 , Analysis, Mathematics and Statistics  
MATH7904 , Research Topics in Mathematics 1, Mathematics and Statistics  
MATH7905 , Research Topics in Mathematics 2, Mathematics and Statistics  
MATH7906 , Research Topics in Mathematics 3, Mathematics and Statistics  
MATH7907 , Advanced Methods in Mathematics 1, Mathematics and Statistics  
MATH7908 , Advanced Methods in Mathematics 2, Mathematics and Statistics  
MATH8990 , Mathematics,Owned at Faculty level 
MECH1001 , Introduction to Mechanical Engineering, Engineering 
MECH2001 , Engineering Dynamics, Engineering 
MECH2002 , Fluid Mechanics, Engineering 
MECH2003 , Mechanical Design 1, Engineering 
MECH2004 , Mechanics of Solids, Engineering 
MECH2005 , Engineering Materials, Engineering 
MECH3001 , Thermodynamics, Engineering 
MECH3002 , Heat and Mass Transfer, Engineering 
MECH3003 , Mechanical Design 2, Engineering 
MECH3004 , Applied Numerical Engineering, Engineering 
MECH3005 , Manufacturing Engineering, Engineering 
MECH4001 , Product Design Engineering, Engineering 
MECH4002 , Energy Sustainable Design, Engineering 
MECH4092 , Mechanical Engineering Research Thesis A, Engineering 
MECH4093 , Mechanical Engineering Research Thesis B, Engineering 
MEDI1400 ," Foundations of Learning,  Communication and Teamwork",Owned at Faculty level 
MEDI2004 , Pharmacology Fundamentals,Owned at Faculty level 
MEDI2005 , Human Health and Disease Processes,Owned at Faculty level 
MEDI2100 , Musculoskeletal System,Owned at Faculty level 
MEDI2101 , Cardiovascular and Respiratory System,Owned at Faculty level 
MEDI2102 ," Renal, Reproductive and Endocrine Systems",Owned at Faculty level 
MEDI2103 ," Alimentary System, Nutrition and Metabolism",Owned at Faculty level 
MEDI2200 , Human Cell and Molecular Biology,Owned at Faculty level 
MEDI2201 , Clinical Bioinformatics,Owned at Faculty level 
MEDI2300 , Nervous System,Owned at Faculty level 
MEDI2301 , Cellular and Molecular Neuroscience,Owned at Faculty level 
MEDI2400 , Foundations in Ethics and Society,Owned at Faculty level 
MEDI2401 , Medical Admissions Preparation,Owned at Faculty level 
MEDI2900 , Introduction to Medical Research, Biomedical Sciences  
MEDI3100 , Clinical Anatomy and Medical Imaging,Owned at Faculty level 
MEDI3200 , Translational Biology and Genomics,Owned at Faculty level 
MEDI3300 , Neuroscience,Owned at Faculty level 
MEDI3301 , Clinical Neuroscience,Owned at Faculty level 
MEDI3400 , Contextualising Professionalism in Health Care Systems,Owned at Faculty level 
MEDI3401 , Professional Learning in the Clinical Sciences,Owned at Faculty level 
MEDI3900 , Research Experience and Training,Owned at Faculty level 
MEDI3901 , Further Research Experience,Owned at Faculty level 
MEDI6101 , Fundamentals in Visceral Anatomy,Owned at Faculty level 
MEDI7000 , Research Communications,Owned at Faculty level 
MEDI7001 ," Ethics, Integrity and Practice",Owned at Faculty level 
MEDI7004 , Decoding the Brain,Owned at Faculty level 
MEDI7007 , Unlocking the Mechanisms of Human Disease,Owned at Faculty level 
MEDI7010 , Unmasking Health Services Research,Owned at Faculty level 
MEDI7012 , Pitching Your Research For Funding,Owned at Faculty level 
MEDI7041 , Research Rotation 1,Owned at Faculty level 
MEDI7042 , Research Rotation 2,Owned at Faculty level 
MEDI7047 , Research Project Management,Owned at Faculty level 
MEDI7051 , The Artificial Human,Owned at Faculty level 
MEDI7101 , Epidemiology and Biostatistics for Research,Owned at Faculty level 
MEDI8100 , Applied Medical Science 1,Owned at Faculty level 
MEDI8101 , Clinical Practice 1,Owned at Faculty level 
MEDI8102 ,Based Healthcare,Owned at Faculty level 
MEDI8103 , Applied Medical Science 2,Owned at Faculty level 
MEDI8104 , Clinical Practice 2,Owned at Faculty level 
MEDI8105 , Interprofessional Healthcare,Owned at Faculty level 
MEDI8203 ," Critical Care, Patient Safety and Quality, and Research",Owned at Faculty level 
MEDI8204 , Reflective Medical Practice 1,Owned at Faculty level 
MEDI8300 , Research Project A,Owned at Faculty level 
MEDI8301 , Core Clinical Placements A,Owned at Faculty level 
MEDI8302 , Core Clinical Placements B,Owned at Faculty level 
MEDI8401 , Advanced Clinical Placements A,Owned at Faculty level 
MEDI8402 , Advanced Clinical Placements B,Owned at Faculty level 
MEDI8403 , Reflective Medical Practice 2,Owned at Faculty level 
MGMT1002 , Principles of Management, Management  
MGMT1005 , Introduction to Global Business, Management  
MGMT1007 , Introduction to Human Resource Management, Management  
MGMT1011 , Organisational Behaviour, Management  
MGMT1020 , Entrepreneurship and New Venture Management, Management  
MGMT2002 , International Business Operations, Management  
MGMT2010 , Leadership in Management, Management  
MGMT2016 , Business Demographics, Management  
MGMT2018 , Management Communication, Management  
MGMT2022 , Foundations in Human Resources Law, Management  
MGMT2025 , Social Entrepreneurship, Management  
MGMT2030 , Cross Cultural Management, Management  
MGMT2031 , Sustainability in International Business, Management  
MGMT2040 , Workplace Relations, Management  
MGMT2050 , Staffing Organisations, Management  
MGMT2080 , Application of Business Models, Management  
MGMT3000 , The Art of Negotiation, Management  
MGMT3001 , Global Business Strategy, Management  
MGMT3002 , HRM Project, Management  
MGMT3003 , International Business Project, Management  
MGMT3007 , International Human Resource Management, Management  
MGMT3011 , Entrepreneurship Project, Management  
MGMT3015 , Managing Performance and Rewards, Management  
MGMT3017 , Managing Change in Organisations, Management  
MGMT3020 , Management Project, Management  
MGMT3028 , Strategic Human Resource Management, Management  
MGMT3050 , Strategic Management, Management  
MGMT3051 , Management Ethics and Social Responsibility, Management  
MGMT3060 , Business Project, Management  
MGMT3902 , Communication for Effective Leadership, Management  
MGMT3904 , Creativity and Innovation, Management  
MGMT3905 , Problem Solving: Critical and Strategic Thinking, Management  
MGMT3906 , Leadership and Influence in Action, Management  
MGMT6008 , Managing People, Management  
MGMT6051 ," Work, Organisation and Management", Management  
MGMT7015 , Behaviour in Organisations, Management  
MGMT7027 , Entrepreneurship in Business, Management  
MGMT7050 , Management of People at Work, Management  
MGMT7054 , Managing Cultural Diversity, Management  
MGMT8003 , Globalisation and Value Chain Management, Management  
MGMT8004 , International Business Strategy, Management  
MGMT8005 , Managing Technology, Management  
MGMT8009 , Managing Globally, Management  
MGMT8010 , Professional Practice, Management  
MGMT8011 , Learning to be a Leader, Management  
MGMT8012 , Managing Strategically, Management  
MGMT8015 , Behaviour in Organisations, Management  
MGMT8025 , Negotiation and Conflict Resolution, Management  
MGMT8027 , Entrepreneurship in Business, Management  
MGMT8028 , Managing Supply Chains, Management  
MGMT8040 , Business Project Management, Management  
MGMT8050 , Management of People at Work, Management  
MGMT8051 , International Human Resource Management, Management  
MGMT8054 , Managing Cultural Diversity, Management  
MGMT8055 , International Business Project, Management  
MGMT8066 , Change Management, Management  
MGMT8077 , Learning to be Persuasive, Management  
MGMT8080 , Business Internship, Management  
MGMT8990 , Management,Management
