courseCode,courseName,major
AACG8990 , Accounting and Corporate Governance, Accounting and Corporate Governance  
ABST1000 , Introducing Indigenous Australia, Indigenous Studies  
ABST1020 ," Dharug Country: Presences, Places and People", Indigenous Studies  
ABST2020 , Indigenous Culture and Text, Indigenous Studies  
ABST2035 , Indigenous Queer Studies, Indigenous Studies  
ABST2060 , Indigenous Histories and Knowledges, Indigenous Studies  
ABST3025 , Indigenous Research Methodologies, Indigenous Studies  
ABST3035 , Indigenous Queer Theory & Practice, Indigenous Studies  
ABST3040 , Indigenous Policy: Politics and Activism, Indigenous Studies  
ABST8990 , Indigenous Studies, Indigenous Studies  
ABSX1000 , Introducing Indigenous Australia, Indigenous Studies  
ABSX1020 ," Dharug Country: Presences, Places and People", Indigenous Studies  
ABSX1030 , Introduction to Indigenous Queer Studies, Indigenous Studies  
ABSX2020 , Indigenous Culture and Text, Indigenous Studies  
ABSX2035 , Indigenous Queer Studies, Indigenous Studies  
ABSX2060 , Indigenous Histories and Knowledges, Indigenous Studies  
ABSX3025 , Indigenous Research Methodologies, Indigenous Studies  
ABSX3035 , Indigenous Queer Theory and Practice, Indigenous Studies  
ABSX3040 , Indigenous Policy: Politics and Activism, Indigenous Studies  
ACCG1000 , Accounting in Society, Accounting and Corporate Governance  
ACCG1001 , Accounting and Governance, Accounting and Corporate Governance  
ACCG2000 , Management Accounting, Accounting and Corporate Governance  
ACCG2002 , Finance and Regulation for New Ventures, Accounting and Corporate Governance  
ACCG2024 , Financial Accounting and Reporting, Accounting and Corporate Governance  
ACCG2050 , Information Systems and Business Processes, Accounting and Corporate Governance  
ACCG2051 , Business and Corporations Law, Accounting and Corporate Governance  
ACCG2065 , Blockchain for Business, Accounting and Corporate Governance  
ACCG2067 , Foundations of Forensic and Data Analytics, Accounting and Corporate Governance  
ACCG3001 , Organisational Planning and Control, Accounting and Corporate Governance  
ACCG3008 , Corporate Accounting and Business Advisory, Accounting and Corporate Governance  
ACCG3015 , Accountants in the Profession, Accounting and Corporate Governance  
ACCG3020 , Taxation Law and Practice, Accounting and Corporate Governance  
ACCG3025 , Cyber Security and Privacy, Accounting and Corporate Governance  
ACCG3030 , Strategic Management Accounting, Accounting and Corporate Governance  
ACCG3040 , Auditing and Assurance Services, Accounting and Corporate Governance  
ACCG3050 , Financial Statement Analysis, Accounting and Corporate Governance  
ACCG3055 , Information Systems for Management, Accounting and Corporate Governance  
ACCG3058 , Information Systems Audit and Assurance, Accounting and Corporate Governance  
ACCG3060 , Cyber Security Governance and Ethics, Accounting and Corporate Governance  
ACCG6003 , Managing Finance, Accounting and Corporate Governance  
ACCG6011 , Principles of Accounting, Accounting and Corporate Governance  
ACCG6014 , Business and Company Law, Accounting and Corporate Governance  
ACCG7025 , Auditing and Assurance Services, Accounting and Corporate Governance  
ACCG7027 , Current Issues in Accounting and Corporate Governance, Accounting and Corporate Governance  
ACCG7028 , Management Control Systems, Accounting and Corporate Governance  
ACCG7035 , International Accounting, Accounting and Corporate Governance  
ACCG8022 , Information Systems in Business, Accounting and Corporate Governance  
ACCG8025 , Management Accounting: Strategy and Control, Accounting and Corporate Governance  
ACCG8028 , Management Control Systems, Accounting and Corporate Governance  
ACCG8035 , International Accounting, Accounting and Corporate Governance  
ACCG8042 , Measuring and Managing Performance, Accounting and Corporate Governance  
ACCG8047 , Fundamentals of Forensic Accounting, Accounting and Corporate Governance  
ACCG8048 , Business and Professional Ethics, Accounting and Corporate Governance  
ACCG8076 , Forensic and Data Analytics, Accounting and Corporate Governance  
ACCG8077 , Forensic Accountants and the Courts, Accounting and Corporate Governance  
ACCG8078 , Investigation Engagements, Accounting and Corporate Governance  
ACCG8086 ," Cyber Security, Governance Frameworks and Ethics", Accounting and Corporate Governance  
ACCG8089 , Loss and Damage and other Dispute Engagements, Accounting and Corporate Governance  
ACCG8092 , Blockchain for Competitive Advantage, Accounting and Corporate Governance  
ACCG8121 , Managerial Accounting, Accounting and Corporate Governance  
ACCG8123 , Accounting Standards and Practice, Accounting and Corporate Governance  
ACCG8124 , Taxation Law, Accounting and Corporate Governance  
ACCG8125 , Auditing and Assurance Services, Accounting and Corporate Governance  
ACCG8126 , Corporate Accounting, Accounting and Corporate Governance  
ACCG8127 , Current Issues in Accounting and Corporate Governance, Accounting and Corporate Governance  
ACCG8141 , Strategic Business Leader I, Accounting and Corporate Governance  
ACCG8142 , Strategic Business Reporting, Accounting and Corporate Governance  
ACCG8143 , Strategic Business Leader II, Accounting and Corporate Governance  
ACCG8144 , Advanced Financial Management, Accounting and Corporate Governance  
ACCG8145 , Advanced Audit and Assurance, Accounting and Corporate Governance  
ACCG8146 , Advanced Performance Management, Accounting and Corporate Governance  
ACCG8150 , Contemporary Accounting Practice, Accounting and Corporate Governance  
ACCG8220 , Audit and Assurance, Accounting and Corporate Governance  
ACCG8221 , Financial Accounting and Reporting, Accounting and Corporate Governance  
ACCG8222 , Management Accounting and Applied Finance, Accounting and Corporate Governance  
ACCG8223 , Taxation, Accounting and Corporate Governance  
ACCG8224 , CA ?C Integrative, Accounting and Corporate Governance  
ACCG8303 , Global Strategy and Leadership, Accounting and Corporate Governance  
ACCG8304 , Advanced Audit and Assurance, Accounting and Corporate Governance  
ACCG8305 , Financial Risk Management, Accounting and Corporate Governance  
ACCG8307 , Financial Reporting, Accounting and Corporate Governance  
ACCG8308 , Strategic Management Accounting, Accounting and Corporate Governance  
ACCG8309 , Advanced, Accounting and Corporate Governance  
ACCG8313 , Ethics and Governance, Accounting and Corporate Governance  
ACOM1001 , Academic Communication in the Social Sciences and Humanities, Linguistics  
ACST1001 , Finance 1A, Actuarial Studies and Business Analytics  
ACST1052 , Introduction to Actuarial Studies, Actuarial Studies and Business Analytics  
ACST2001 , Financial Modelling, Actuarial Studies and Business Analytics  
ACST2002 , Mathematics of Finance, Actuarial Studies and Business Analytics  
ACST2052 , Finance and Financial Reporting, Actuarial Studies and Business Analytics  
ACST2055 , Contingent Payments, Actuarial Studies and Business Analytics  
ACST3006 , Quantitative Asset and Liability Modelling 1, Actuarial Studies and Business Analytics  
ACST3007 , Quantitative Asset and Liability Modelling 2, Actuarial Studies and Business Analytics  
ACST3058 , Survival Models, Actuarial Studies and Business Analytics  
ACST3059 , Actuarial Modelling, Actuarial Studies and Business Analytics  
ACST4002 , Actuarial Control Cycle 1, Actuarial Studies and Business Analytics  
ACST4003 , Actuarial Control Cycle 2, Actuarial Studies and Business Analytics  
ACST4005 , Actuarial Data Analytics, Actuarial Studies and Business Analytics  
ACST6003 , Principles of Finance, Actuarial Studies and Business Analytics  
ACST7031 , Actuarial Control Cycle 1, Actuarial Studies and Business Analytics  
ACST8029 , Capital Budgeting and Financial Modelling, Actuarial Studies and Business Analytics  
ACST8031 , Actuarial Control Cycle 1, Actuarial Studies and Business Analytics  
ACST8032 , Actuarial Control Cycle 2, Actuarial Studies and Business Analytics  
ACST8040 , Quantitative Research Methods, Actuarial Studies and Business Analytics  
ACST8052 , Finance and Financial Reporting, Actuarial Studies and Business Analytics  
ACST8081 , Mathematics of Finance, Actuarial Studies and Business Analytics  
ACST8082 , Contingent Payments, Actuarial Studies and Business Analytics  
ACST8083 , Actuarial Statistics, Actuarial Studies and Business Analytics  
ACST8084 , Survival Models, Actuarial Studies and Business Analytics  
ACST8085 , Quantitative Methods for Risk Analysis, Actuarial Studies and Business Analytics  
ACST8086 , Actuarial Modelling, Actuarial Studies and Business Analytics  
ACST8087 , Quantitative Asset and Liability Modelling 1, Actuarial Studies and Business Analytics  
ACST8088 , Quantitative Asset and Liability Modelling 2, Actuarial Studies and Business Analytics  
ACST8095 , Actuarial Data Analytics, Actuarial Studies and Business Analytics  
AFCL8001 , Portfolio Management and Valuation, Applied Finance  
AFCL8002 , Professional Practice, Applied Finance  
AFCL8003 , Corporate Finance, Applied Finance  
AFCL8004 , Financial Instruments, Applied Finance  
AFCL8005 , Financial Risk Management, Applied Finance  
AFCL8050 , Corporate Treasury Management, Applied Finance  
AFCL8054 , Investment and Credit Analysis, Applied Finance  
AFCL8056 , Lending and Borrowing Decisions, Applied Finance  
AFCL8086 , Debt Capital Markets, Applied Finance  
AFCL8090 , Equity Capital Markets, Applied Finance  
AFCL8094 , Private Wealth Management, Applied Finance  
AFCL8095 , Private Equity Investment, Applied Finance  
AFCP6016 , Finance Principles, Applied Finance  
AFCP6017 , Case Studies in Applied Finance, Applied Finance  
AFCP6018 , Quantitative and Economic Analysis, Applied Finance  
AFCP6019 , Financial Statement Analysis and Modelling, Applied Finance  
AFCP8003 , Corporate Finance, Applied Finance  
AFCP8050 , Corporate Treasury Management, Applied Finance  
AFCP8054 , Investment and Credit Analysis, Applied Finance  
AFCP8061 , Corporate Financial Strategy, Applied Finance  
AFCP8086 , Debt Capital Markets, Applied Finance  
AFCP8094 , Private Wealth Management, Applied Finance  
AFCX6016 , Finance Principles, Applied Finance  
AFCX6017 , Case Studies in Applied Finance, Applied Finance  
AFCX6018 , Quantitative and Economic Analysis, Applied Finance  
AFCX6019 , Financial Statement Analysis and Modelling, Applied Finance  
AFIN1002 , Finance 1B, Applied Finance  
AFIN2000 , Principles of Financial Literacy, Applied Finance  
AFIN2050 , Investments, Applied Finance  
AFIN2053 , Financial Management, Applied Finance  
AFIN2070 , Stochastic Methods in Applied Finance, Applied Finance  
AFIN3010 , Issues in Applied Finance, Applied Finance  
AFIN3012 , Issues in Corporate Finance, Applied Finance  
AFIN3028 , Financial Risk Management, Applied Finance  
AFIN3029 , Derivative Instruments, Applied Finance  
AFIN3052 , Applied Portfolio Management, Applied Finance  
AFIN3053 , Advanced Corporate Finance, Applied Finance  
AFIN6013 , Financial Statement Analysis and Modelling, Applied Finance  
AFIN7001 , Finance Theory, Applied Finance  
AFIN7002 , Finance Empirical, Applied Finance  
AFIN7005 , Research in Finance, Applied Finance  
AFIN7008 , Corporate Finance, Applied Finance  
AFIN7039 , Portfolio Management, Applied Finance  
AFIN8001 , Finance Theory, Applied Finance  
AFIN8002 , Finance Empirical, Applied Finance  
AFIN8003 , Banking and Financial Intermediation, Applied Finance  
AFIN8005 , Research Methods in Banking and Finance, Applied Finance  
AFIN8006 , Risk Management and Derivatives, Applied Finance  
AFIN8008 , Corporate Finance, Applied Finance  
AFIN8010 , Environmental Finance, Applied Finance  
AFIN8011 , Business and Global Environmental Change, Applied Finance  
AFIN8012 , Fixed Income and Credit Analysis, Applied Finance  
AFIN8013 , Alternative Securities, Applied Finance  
AFIN8014 , FinTech and Innovation, Applied Finance  
AFIN8015 , Financial Data Science, Applied Finance  
AFIN8016 ," Payments, Cryptocurrencies and Blockchain", Applied Finance  
AFIN8017 , Digital Finance, Applied Finance  
AFIN8018 , Investments, Applied Finance  
AFIN8037 , Capital Markets, Applied Finance  
AFIN8038 , Business Valuation, Applied Finance  
AFIN8039 , Portfolio Management, Applied Finance  
AFIN8067 , International Financial Management, Applied Finance  
AFIN8081 , Professional Development in Banking and Finance, Applied Finance  
AFIN8090 , Financial Modelling and Forecasting, Applied Finance  
AFIN8099 , Current Issues in Banking and Finance, Applied Finance  
AHIS1110 , Ancient Greek A, History and Archaeology 
AHIS1120 , Latin A, History and Archaeology 
AHIS1150 , Hieroglyphic Egyptian A, History and Archaeology 
AHIS1200 , Myth in the Ancient World, History and Archaeology 
AHIS1210 , Studying the Past from the Bronze Age to Byzantium, History and Archaeology 
AHIS1250 , Ancient Egyptian and Near Eastern Archaeology, History and Archaeology 
AHIS1300 , Digging up the Past: An Introduction to Archaeology, History and Archaeology 
AHIS1301 , World Archaeology, History and Archaeology 
AHIS2110 , Ancient Greek B, History and Archaeology 
AHIS2120 , Latin B, History and Archaeology 
AHIS2130 , Byzantium in the Age of the Emperors, History and Archaeology 
AHIS2150 , Hieroglyphic Egyptian B, History and Archaeology 
AHIS2210 , From Alexander the Great to Augustus: The Hellenistic Age , History and Archaeology 
AHIS2211 , Minos and Mycenae: The Aegean Bronze Age, History and Archaeology 
AHIS2225 , Rome and the Caesars , History and Archaeology 
AHIS2250 , Ancient Egypt: Culture and Society, History and Archaeology 
AHIS2251 , Ancient Egyptian and Near Eastern Art: Theory and Practice, History and Archaeology 
AHIS2301 , Archaeology of Death and Burial, History and Archaeology 
AHIS2302 , Archaeology and Society: Archaeological Evidence, History and Archaeology 
AHIS3000 , Capstone in Ancient History and Archaeology, History and Archaeology 
AHIS3001 , Material Culture and Museum Studies, History and Archaeology 
AHIS3005 , Cultural Heritage and Public History, History and Archaeology 
AHIS3100 , Ancient Languages Special Topic A, History and Archaeology 
AHIS3101 , Ancient Languages Special Topic B, History and Archaeology 
AHIS3110 , Ancient Greek C, History and Archaeology 
AHIS3120 , Latin C, History and Archaeology 
AHIS3150 , Hieroglyphic Egyptian C, History and Archaeology 
AHIS3201 , Women and Gender in the Ancient World, History and Archaeology 
AHIS3202 , A History of Magic: From the Magi to Merlin, History and Archaeology 
AHIS3241 , Dialogue of Cultures: Ancient Egypt and the Near East, History and Archaeology 
AHIS3251 , State Formation: Egypt and the Near East, History and Archaeology 
AHIS3302 , Laboratory Methods of Archaeology, History and Archaeology 
AHIS7001 , Advanced Studies in Ancient History and Archaeology: Material Worlds, History and Archaeology 
AHIS8000 , Capstone Advanced Project, History and Archaeology 
AHIS8210 , History Writing in Antiquity: Herodotus and Thucydides, History and Archaeology 
AHIS8211 ,404 BC, History and Archaeology 
AHIS8213 , Egypt: Alexander to Augustus, History and Archaeology 
AHIS8221 , Caravan Cities, History and Archaeology 
AHIS8230 , City of Constantine, History and Archaeology 
AHIS8252 , Egypt in the Age of Akhenaten and Tutankhamun, History and Archaeology 
AHIS8320 , Under the Shadow of Vesuvius: Archaeology in Ancient Campania, History and Archaeology 
AHIS8990 , Ancient History, History and Archaeology 
AHIX1110 , Ancient Greek A, History and Archaeology 
AHIX1120 , Latin A, History and Archaeology 
AHIX1200 , Myth in the Ancient World, History and Archaeology 
AHIX1210 , Studying the Past from the Bronze Age to Byzantium, History and Archaeology 
AHIX1250 , Ancient Egyptian and Near Eastern Archaeology, History and Archaeology 
AHIX2040 , Ancient Greek Religion, History and Archaeology 
AHIX2130 , Byzantium in the Age of the Emperors , History and Archaeology 
AHIX2210 , From Alexander the Great to Augustus: The Hellenistic Age, History and Archaeology 
AHIX2211 , Minos and Mycenae: The Aegean Bronze Age, History and Archaeology 
AHIX2225 , Rome and the Caesars , History and Archaeology 
AHIX2251 , Ancient Egyptian and Near Eastern Art: Theory and Practice, History and Archaeology 
AHIX2300 , Landscape Archaeology, History and Archaeology 
AHIX3000 , Capstone in Ancient History and Archaeology, History and Archaeology 
AHIX3001 , Material Culture and Museum Studies, History and Archaeology 
AHIX3201 , Women and Gender in the Ancient World, History and Archaeology 
AHIX3202 , A History of Magic: From the Magi to Merlin, History and Archaeology 
AHIX3241 , Dialogue of Cultures: Ancient Egypt and the Near East, History and Archaeology 
AHIX6100 , Ancient Languages Foundation, History and Archaeology 
AHIX6200 , Ancient Language Studies: Foundation in Ancient Language, History and Archaeology 
AHIX6201 , Ancient Historiographical and Historical Studies: Foundation, History and Archaeology 
AHIX6202 , Archaeological and Historical Studies: Foundation in Archaeology or History, History and Archaeology 
AHIX8000 , Capstone Advanced Project, History and Archaeology 
AHIX8210 , History Writing in Antiquity: Herodotus and Thucydides, History and Archaeology 
AHIX8211 ,404 BC, History and Archaeology 
AHIX8213 , Egypt: Alexander to Augustus, History and Archaeology 
AHIX8221 , Caravan Cities, History and Archaeology 
AHIX8230 , City of Constantine, History and Archaeology 
AHIX8252 , Egypt in the Age of Akhenaten and Tutankhamun, History and Archaeology 
AHIX8320 , Under the Shadow of Vesuvius: Archaeology in Ancient Campania, History and Archaeology 
AIHI8990 , Health Innovation, Health Innovation 
ANAT1001 , Introduction to Anatomy, Chiropractic  
ANAT1002 , Anatomy of Limbs and Back, Chiropractic  
ANAT2003 ," Anatomy of Head, Neck and Trunk", Chiropractic  
ANAT2004 , Neuroanatomy, Chiropractic  
ANAT7911 , Anatomical Dissection, Chiropractic  
ANTH1006 , Drugs Across Cultures, Social Sciences 
ANTH1007 ," Saints, Shamans, Cults and Demons: The Anthropology of Contemporary Religions", Social Sciences 
ANTH1050 , Identity and Difference: Introduction to Anthropology, Social Sciences 
ANTH1051 , Human Evolution and Diversity, Social Sciences 
ANTH2002 , Illness and Healing, Social Sciences 
ANTH2003 , Food Across Cultures, Social Sciences 
ANTH2007 , Psychological Anthropology, Social Sciences 
ANTH2008 ," Cults, \u200bSaints, and Shamans: Religion and Society", Social Sciences 
ANTH2021 , Development Studies: The Anthropology of International Aid, Social Sciences 
ANTH2024 ," Mad, Bad, Sad: Cross Cultural Perspectives", Social Sciences 
ANTH2051 , Human Evolution and Diversity, Social Sciences 
ANTH3008 , Psychological Anthropology, Social Sciences 
ANTH3010 ," Culture, Myth and Religion", Social Sciences 
ANTH3021 ," Globalisation, Conflict, and Religion", Social Sciences 
ANTH3022 ," Gender, Sexuality and Global Health", Social Sciences 
ANTH3023 , Development Studies: Poverty and Global Justice, Social Sciences 
ANTH3024 , Doing Ethnography, Social Sciences 
ANTH7000 , Core Issues in Anthropological Theory I, Social Sciences 
ANTH7001 , Core Issues in Anthropological Theory II, Social Sciences 
ANTH8015 , Development Theory and Practice, Social Sciences 
ANTH8016 ," Culture, Health and Disease", Social Sciences 
ANTH8032 , Global Health, Social Sciences 
ANTH8990 , Anthropology, Social Sciences 
ANTX1006 , Drugs Across Cultures, Social Sciences 
ANTX1051 , Human Evolution and Diversity, Social Sciences 
ANTX2002 , Illness and Healing, Social Sciences 
ANTX2007 , Psychological Anthropology, Social Sciences 
ANTX2051 , Human Evolution and Diversity, Social Sciences 
ANTX3008 , Psychological Anthropology, Social Sciences 
APFN8990 , Applied Finance,[
APPL6000 , Language Teaching Methodologies, Linguistics  
APPL6010 , Planning and Programming in TESOL, Linguistics  
APPL7020 ,related Research, Linguistics  
APPL8010 ," Genre, Discourse and Multimodality", Linguistics  
APPL8020 , Research Methods in Language Study, Linguistics  
APPL8030 , Languages and Cultures in Contact, Linguistics  
APPL8100 , Exploring Discourse in Context and Action, Linguistics  
APPL8110 , Pragmatics and Intercultural Communication, Linguistics  
APPL8120 ," Language, Learning and Community", Linguistics  
APPL8200 , Linguistics and Language Teaching, Linguistics  
APPL8220 , Practicum in TESOL, Linguistics  
APPL8230 ," Classroom, Curriculum and Context", Linguistics  
APPL8240 , Language Testing and Evaluation, Linguistics  
APPL8250 , Second Language Acquisition, Linguistics  
APPL8260 , Language Teaching and Learning Beyond the Classroom, Linguistics  
APPL8270 , Reading Development and Disorders, Linguistics  
APPL8290 , Evaluating Language Classroom Practice, Linguistics  
APPL8400 , Language for Specific Purposes, Linguistics  
APPL8410 , Literacies, Linguistics  
APPL8420 , Teaching English for Academic Purposes, Linguistics  
ARTS1000 , Humanities and the World,Owned at Faculty level 
ARTS2000 , International Exchange Experience,Owned at Faculty level 
ARTS3000 , Cultural and Social Action,Owned at Faculty level 
ARTS3100 , Governance and Resistance,Owned at Faculty level 
ARTS3500 , Arts Capstone,Owned at Faculty level 
ARTX1000 , Humanities and the World,Owned at Faculty level 
ARTX3500 , Arts Capstone,Owned at Faculty level 
ASBA8990 , Actuarial Studies and Business Analytics,Owned at Faculty level 
ASTR2020 , Observational Astronomy, Physics and Astronomy  
ASTR3010 , Astrophysics of Radiation and Stars, Physics and Astronomy  
ASTR3020 , Extragalactic Astronomy and Cosmology, Physics and Astronomy  
ASTR3110 , Data Science Techniques in Astrophysics, Physics and Astronomy  
ASTR7907 , Advanced Astrophysics, Physics and Astronomy  
ASTR7913 , Contemporary Research Techniques in Astrophysics, Physics and Astronomy  
BIOL1110 , Genes to Organisms, Biological Sciences 
BIOL1210 , Human Biology, Biological Sciences 
BIOL1310 , Organisms to Ecosystems, Biological Sciences 
BIOL1320 , Biological Basis of Behaviour, Biological Sciences 
BIOL1620 , Foundation in Medical Sciences, Biological Sciences 
BIOL2110 , Genetics, Biological Sciences 
BIOL2210 , Life Processes, Biological Sciences 
BIOL2220 , Systems Physiology, Biological Sciences 
BIOL2230 , Neurophysiology, Biological Sciences 
BIOL2310 , Diversity of Life, Biological Sciences 
BIOL2410 , Ecology, Biological Sciences 
BIOL2610 , Biological Data Analysis, Biological Sciences 
BIOL3110 , Evolutionary and Conservation Genetics, Biological Sciences 
BIOL3120 , Human Genetics and Evolutionary Medicine, Biological Sciences 
BIOL3210 , Advanced Human Physiology, Biological Sciences 
BIOL3310 , Invertebrate Biology and Behaviour, Biological Sciences 
BIOL3410 , Plant Biology, Biological Sciences 
BIOL3420 , Biodiversity and Conservation, Biological Sciences 
BIOL3440 , Aquatic Ecosystems, Biological Sciences 
BIOL3510 , Vertebrate Biology and Behaviour, Biological Sciences 
BIOL3520 , Palaeobiology, Biological Sciences 
BIOL3630 , Special Interest Topics in Biology, Biological Sciences 
BIOL3640 , PACE Experience in Biological Sciences, Biological Sciences 
BIOL3660 , Medical Sciences Capstone, Biological Sciences 
BIOL3661 , Medical Sciences Capstone, Biological Sciences 
BIOL6110 , Genetics, Biological Sciences 
BIOL6210 , Life Processes, Biological Sciences 
BIOL6310 , Diversity of Life, Biological Sciences 
BIOL6410 , Ecology, Biological Sciences 
BIOL6610 , Biological Data Analysis, Biological Sciences 
BIOL7130 , Research Skills for Biology, Biological Sciences 
BIOL7610 , Conservation and Management of Wild Populations, Biological Sciences 
BIOL7750 , Contemporary Conservation in Australia, Biological Sciences 
BIOL7760 , Climate Change Biology: Impacts and Adaptation, Biological Sciences 
BIOL7770 , Topics in Australian Marine Science, Biological Sciences 
BIOL7870 , Regional and Global Conservation, Biological Sciences 
BIOL7900 , Research Frontiers in Biology, Biological Sciences 
BIOL7910 , Research Topic in Biology 1, Biological Sciences 
BIOL7915 , Research Topic in Biology 2, Biological Sciences 
BIOL7920 , Topics in Evolution, Biological Sciences 
BIOL7925 , Biology in the 21st Century, Biological Sciences 
BIOL7935 , Advanced Research Topics in Biology, Biological Sciences 
BIOL8600 , Biology Research Experience, Biological Sciences 
BIOL8601 , Biology Research Placement, Biological Sciences 
BIOL8610 , Conservation and Management of Wild Populations, Biological Sciences 
BIOL8710 , Conservation in Practice, Biological Sciences 
BIOL8720 , Cross Institutional Study, Biological Sciences 
BIOL8750 , Contemporary Conservation in Australia, Biological Sciences 
BIOL8760 , Climate Change Biology: Impacts and Adaptation, Biological Sciences 
BIOL8770 , Topics in Australian Marine Science, Biological Sciences 
BIOL8870 , Regional and Global Conservation, Biological Sciences 
BIOL8990 , Biology, Biological Sciences 
BIOM8990 , Biomedical Science,Owned at Faculty level 
BIOX1110 , Genes to Organisms\xa0, Biological Sciences 
BIOX1210 , Human Biology, Biological Sciences 
BIOX1310 , Organisms to Ecosystems\xa0, Biological Sciences 
BIOX1320 , Biological Basis of Behaviour, Biological Sciences 
BIOX2110 , Genetics, Biological Sciences 
BIOX2210 , Life Processes, Biological Sciences 
