courseCode,courseName,major
EDST8430 ," Quality Curriculum, Performance and Regulation in Higher Education", Education 
EDST8470 , Human Resource Management in Education, Education 
EDST8650 ,Enhanced Learning, Education 
EDST8710 , Reflexive Learning and Teaching in Higher Education, Education 
EDST8990 , Educational Studies, Education 
EDST8999 , LANTITE PG, Education 
EDSX8000 , Educational Research , Education 
EDSX8301 , Inclusive and Special Education , Education 
EDTE2480 , Key Competencies in Inclusive Education, Education 
EDTE2510 , Curriculum and Teaching in the Primary School 1, Education 
EDTE2520 , Curriculum and Teaching in the Primary School 2, Education 
EDTE3010 , Professional Experience in the Primary School 1, Education 
EDTE3020 , Introduction to Professional Experience in the Secondary School, Education 
EDTE3530 , Curriculum and Teaching in the Primary School 3, Education 
EDTE3540 , Curriculum and Teaching in the Primary School 4, Education 
EDTE3870 , Curriculum and Instruction in the Secondary School I, Education 
EDTE3880 , Curriculum and Instruction in the Secondary School II, Education 
EDTE4010 , Professional Experience in the Secondary School I, Education 
EDTE4020 , Professional Experience in the Secondary School II, Education 
EDTE4030 , Professional Experience in the Primary School 2, Education 
EDTE4040 , Professional Experience in the Primary School 3, Education 
EDTE4050 , Professional Experience for Specific Purposes, Education 
EDTE4210 , Economics and Business Studies in the Secondary School I, Education 
EDTE4220 , Economics and Business Studies in the Secondary School II, Education 
EDTE4230 , English in the Secondary School I, Education 
EDTE4240 , English in the Secondary School II, Education 
EDTE4250 , Geography in the Secondary School I, Education 
EDTE4260 , Geography in the Secondary School II, Education 
EDTE4270 , History in the Secondary School I, Education 
EDTE4280 , History in the Secondary School II, Education 
EDTE4290 , Mathematics in the Secondary School I, Education 
EDTE4300 , Mathematics in the Secondary School II, Education 
EDTE4310 , Languages in the Secondary School I, Education 
EDTE4320 , Languages in the Secondary School II, Education 
EDTE4330 , Science in the Secondary School I, Education 
EDTE4340 , Science in the Secondary School II, Education 
EDTE4410 , Legal Studies in the Secondary School I, Education 
EDTE4420 , English as a Second Language in Schools I, Education 
EDTE4550 , Curriculum and Teaching in the Primary School 5, Education 
EDTE4560 , Curriculum and Teaching in the Primary School 6, Education 
EDUC1050 , Education: The Psychological Context, Education 
EDUC1060 , Education: The Social and Historical Context, Education 
EDUC1070 , Introduction to Educational Studies, Education 
EDUC2580 , Mathematics in Schools, Education 
EDUC2600 ," Language, Literacy and Learning", Education 
EDUC2610 , Information and Communication Technologies and Education, Education 
EDUC2620 , Education: The Learner, Education 
EDUC2670 , Classroom Management and Assessment, Education 
EDUC2890 , Human Society and its Environment, Education 
EDUC2920 , Research Inquiry in Education, Education 
EDUC3620 , Digital Creativity and Learning, Education 
EDUC3650 , Educational Assessment, Education 
EDUC3710 , Reading Acquisition in the Primary Classroom, Education 
EDUC3730 , Literacy in a Multicultural Society, Education 
EDUC3830 , Education in a Global Society, Education 
EDUC3880 , Aboriginal Education Issues and Approaches, Education 
EDUC3990 ," Professional Capability: Policy, Theory, Pedagogy", Education 
EDUC7000 , Foundations in Educational Research, Education 
EDUC7001 , Introduction to Systematic Reviews in Education, Education 
EDUC8240 , Effective Instruction in Reading and Writing , Education 
EDUC8250 ," Effective Instruction in Mathematics, Science and Technology", Education 
EDUC8270 ," Language, Learning, and Communication", Education 
EESC1150 , Planet Earth, Earth and Environmental Sciences 
EESC1160 ," Blue Planet: Oceans, Climate and Life", Earth and Environmental Sciences 
EESC2150 , Mass extinctions and the hidden history of Earth, Earth and Environmental Sciences 
EESC2160 , Climate and Oceans, Earth and Environmental Sciences 
ELCT3005 , Power Electronics, Engineering 
ELCT3006 , Electrical Machines, Engineering 
ELCT4001 , Smart Power Grids, Engineering 
ELCT4004 , Power Systems Analysis, Engineering 
ELCT4092 , Electrical Engineering Research Thesis A, Engineering 
ELCT4093 , Electrical Engineering Research Thesis B, Engineering 
ELEC2005 , Electrical and Electronic Systems, Engineering 
ELEC2040 , Signals and Systems, Engineering 
ELEC2042 , Digital Circuits and Systems, Engineering 
ELEC2070 , Linear Circuits and Devices, Engineering 
ELEC2075 , Nonlinear Circuits and Devices, Engineering 
ELEC3024 , Control Systems, Engineering 
ELEC3042 , Embedded Systems, Engineering 
ELEC3076 , Electronic Devices and Systems, Engineering 
ELEC4092 , Electrical and Electronic Engineering Research Thesis A, Engineering 
ELEC4093 , Electrical and Electronic Engineering Research Thesis B, Engineering 
ELEC4150 , Electronic Design Proficiency, Engineering 
ELEC4250 , System on Chip Design, Engineering 
ELEC8040 ," VLSI, Algorithms, and Systems", Engineering 
ELEC8150 , Electronic Design Proficiency, Engineering 
ELEC8250 , System on Chip Design, Engineering 
ELEC8276 , Electronic Systems Design, Engineering 
ELEC8844 , Signal Processing for Software Defined Radio, Engineering 
ELEC8860 , Hardware Security, Engineering 
ELEC8870 , High Performance IC Design, Engineering 
ENGG1000 , Introduction to Engineering, Engineering 
ENGG1050 , Engineering Design, Engineering 
ENGG2000 , Engineering Practice, Engineering 
ENGG3000 , Engineering Project Practice, Engineering 
ENGG4000 , Systems Design and Engineering, Engineering 
ENGG4001 , Professional Practice, Engineering 
ENGG4092 , Engineering Research Thesis Extension A, Engineering 
ENGG4093 , Engineering Research Thesis Extension B, Engineering 
ENGG4104 , Engineering Contracts and Procurement, Engineering 
ENGG4201 , Internet of Things Systems Design, Engineering 
ENGG8000 , Professional Practice, Engineering 
ENGG8090 , Engineering Project 1, Engineering 
ENGG8105 , Quality and Reliability, Engineering 
ENGG8106 , Engineering Entrepreneurship, Engineering 
ENGG8401 , Safety and Risk Engineering, Engineering 
ENGG8990 , Engineering, Engineering 
ENGL1001 , Literature: Medieval to Modern," Media, Communications, Creative Arts, Language and Literature "
ENGL1002 , Literature: Modern and Contemporary," Media, Communications, Creative Arts, Language and Literature "
ENGL1021 , An Introduction to Creative Writing," Media, Communications, Creative Arts, Language and Literature "
ENGL1050 , Grammar and Writing," Media, Communications, Creative Arts, Language and Literature "
ENGL2010 ," The Human Story: Heart, Mind and Body in Early Literature"," Media, Communications, Creative Arts, Language and Literature "
ENGL2020 ," Revolution, Evolution, Humanity: Literature and Change in the Long Nineteenth Century"," Media, Communications, Creative Arts, Language and Literature "
ENGL2030 , Literature and the Visual," Media, Communications, Creative Arts, Language and Literature "
ENGL2033 , Concepts and Practice in Fiction and Poetry ," Media, Communications, Creative Arts, Language and Literature "
ENGL2036 , Writing Popular Genre Fiction," Media, Communications, Creative Arts, Language and Literature "
ENGL2040 , Historical Fiction and a Passion for the Past," Media, Communications, Creative Arts, Language and Literature "
ENGL3007 , Writing the Short Story," Media, Communications, Creative Arts, Language and Literature "
ENGL3010 ,Century Literature: Human to Posthuman," Media, Communications, Creative Arts, Language and Literature "
ENGL3020 , Global Contemporary Literature: Australians and the World," Media, Communications, Creative Arts, Language and Literature "
ENGL3031 , Popular Fiction," Media, Communications, Creative Arts, Language and Literature "
ENGL3035 , Novel and Novella Writing," Media, Communications, Creative Arts, Language and Literature "
ENGL3040 , Following Poetry from Epic to Instagram," Media, Communications, Creative Arts, Language and Literature "
ENGL3051 , Critical Approaches to Literature," Media, Communications, Creative Arts, Language and Literature "
ENGL3060 , Pursuing Research in Literary Studies," Media, Communications, Creative Arts, Language and Literature "
ENGL7000 , Research in Literary Studies and Creative Writing," Media, Communications, Creative Arts, Language and Literature "
ENGL7001 ," Textual Analysis, Literary Theory and Creative Practice Research"," Media, Communications, Creative Arts, Language and Literature "
ENGL8010 , Creative Writing Seminar: Narrative Fundamentals," Media, Communications, Creative Arts, Language and Literature "
ENGL8011 , Word Essentials: Prose and Poetry," Media, Communications, Creative Arts, Language and Literature "
ENGL8015 , An Introduction," Media, Communications, Creative Arts, Language and Literature "
ENGL8017 , Writing the Past," Media, Communications, Creative Arts, Language and Literature "
ENGL8022 ," short story, novella, poetry cycle"," Media, Communications, Creative Arts, Language and Literature "
ENGL8026 ," Manuscript Project (Half Year, Part A)"," Media, Communications, Creative Arts, Language and Literature "
ENGL8030 , Digital Creative Writing: Interactive Prose and Poetry," Media, Communications, Creative Arts, Language and Literature "
ENGL8036 , Manuscript Project B," Media, Communications, Creative Arts, Language and Literature "
ENGL8075 , Professional Context Project," Media, Communications, Creative Arts, Language and Literature "
ENGL8090 , Special Study Unit 1: Research Preparation," Media, Communications, Creative Arts, Language and Literature "
ENGL8091 , Special Study Unit 2: Research Thesis," Media, Communications, Creative Arts, Language and Literature "
ENGL8990 , English," Media, Communications, Creative Arts, Language and Literature "
ENGX1001 , Literature: Medieval to Modern," Media, Communications, Creative Arts, Language and Literature "
ENGX1002 , Literature: Modern and Contemporary," Media, Communications, Creative Arts, Language and Literature "
ENGX1021 , An Introduction to Creative Writing," Media, Communications, Creative Arts, Language and Literature "
ENGX1050 , Grammar and Writing," Media, Communications, Creative Arts, Language and Literature "
ENGX2010 ," The Human Story: Heart, Mind and Body in Early Literature"," Media, Communications, Creative Arts, Language and Literature "
ENGX2020 ," Revolution, Evolution, Humanity: Literature and Change in the Long Nineteenth Century"," Media, Communications, Creative Arts, Language and Literature "
ENGX2030 , Literature and the Visual," Media, Communications, Creative Arts, Language and Literature "
ENGX3007 , Writing the Short Story," Media, Communications, Creative Arts, Language and Literature "
ENGX3010 ,Century Literature: Human to Posthuman," Media, Communications, Creative Arts, Language and Literature "
ENGX3020 , Global Contemporary Literature: Australians and the World," Media, Communications, Creative Arts, Language and Literature "
ENGX3031 , Popular Fiction," Media, Communications, Creative Arts, Language and Literature "
ENGX3035 , Novel and Novella Writing," Media, Communications, Creative Arts, Language and Literature "
ENGX3040 , Following Poetry from Epic to Instagram," Media, Communications, Creative Arts, Language and Literature "
ENGX3051 , Critical Approaches to Literature," Media, Communications, Creative Arts, Language and Literature "
ENGX8010 , Creative Writing Seminar: Narrative Fundamentals," Media, Communications, Creative Arts, Language and Literature "
ENGX8011 , Word Essentials: Prose and Poetry," Media, Communications, Creative Arts, Language and Literature "
ENGX8015 , An Introduction ," Media, Communications, Creative Arts, Language and Literature "
ENGX8017 ,Fiction," Media, Communications, Creative Arts, Language and Literature "
ENGX8022 ," Short Story, Novella, Poetry Cycle"," Media, Communications, Creative Arts, Language and Literature "
ENGX8026 ," Manuscript Project (Half Year, Part A) "," Media, Communications, Creative Arts, Language and Literature "
ENGX8030 , Digital Creative Writing: Interactive Prose and Poetry," Media, Communications, Creative Arts, Language and Literature "
ENGX8036 , Manuscript Project B," Media, Communications, Creative Arts, Language and Literature "
ENGX8075 , Professional Context Project," Media, Communications, Creative Arts, Language and Literature "
ENGX8090 , Special Study Unit 1: Research Preparation ," Media, Communications, Creative Arts, Language and Literature "
ENGX8091 , Special Study Unit 2: Research Thesis ," Media, Communications, Creative Arts, Language and Literature "
ENVS1000 , Environment Skills, Earth and Environmental Sciences 
ENVS1017 , The Living Environment, Earth and Environmental Sciences 
ENVS1018 , Environmental Management for a Changing World, Earth and Environmental Sciences 
ENVS2115 ," Climate Change, Energy and our Future", Earth and Environmental Sciences 
ENVS2237 ," Natural Hazards, Disasters and their Management", Earth and Environmental Sciences 
ENVS2266 , Earth Surface Processes, Earth and Environmental Sciences 
ENVS2364 , Introduction to Geographic Information Science, Earth and Environmental Sciences 
ENVS2467 , Australian Environmental Futures, Earth and Environmental Sciences 
ENVS3101 ," Ocean, Coasts and Climate", Earth and Environmental Sciences 
ENVS3102 , Urban Climate and Air Quality, Earth and Environmental Sciences 
ENVS3238 , Environmental Quality and Assessment, Earth and Environmental Sciences 
ENVS3240 , Environmental Change, Earth and Environmental Sciences 
ENVS3241 , Active Environments, Earth and Environmental Sciences 
ENVS3383 , Environmental Analysis Using Remote Sensing and GIS, Earth and Environmental Sciences 
ENVS3439 , Geomorphic Analysis of Rivers and Wetlands for Conservation and Management, Earth and Environmental Sciences 
ENVS3462 , Environmental Management, Earth and Environmental Sciences 
ENVS3463 , Environmental Management Project, Earth and Environmental Sciences 
ENVS6115 ," Climate Change, Energy and our Future", Earth and Environmental Sciences 
ENVS6116 , The Atmospheric Environment, Earth and Environmental Sciences 
ENVS6202 , The Living Environment, Earth and Environmental Sciences 
ENVS6364 , Introduction to Geographic Information Science, Earth and Environmental Sciences 
ENVS6405 , Australian Environmental Futures, Earth and Environmental Sciences 
ENVS7104 , Climate Change and Adaptation, Earth and Environmental Sciences 
ENVS7205 , Environmental Pollution, Earth and Environmental Sciences 
ENVS7353 , Environmental Applications of GIS and Remote Sensing, Earth and Environmental Sciences 
ENVS7418 , Environmental Planning, Earth and Environmental Sciences 
ENVS7498 , Environmental Remediation, Earth and Environmental Sciences 
ENVS8104 , Climate Change and Adaptation, Earth and Environmental Sciences 
ENVS8205 , Environmental Pollution, Earth and Environmental Sciences 
ENVS8229 , Sustainable Cities, Earth and Environmental Sciences 
ENVS8308 , Introduction to Geographic Information Science for Postgraduates, Earth and Environmental Sciences 
ENVS8353 , Environmental Applications of GIS and Remote Sensing, Earth and Environmental Sciences 
ENVS8403 , Science in Environmental Management, Earth and Environmental Sciences 
ENVS8407 , Field Methods in Environmental Science, Earth and Environmental Sciences 
ENVS8418 , Environmental Planning, Earth and Environmental Sciences 
ENVS8498 , Environmental Remediation, Earth and Environmental Sciences 
ENVS8519 , Environmental Health, Earth and Environmental Sciences 
ENVS8525 , Sustainability and Transitions , Earth and Environmental Sciences 
ENVS8527 , Engaging Society with Sustainable Development, Earth and Environmental Sciences 
ENVS8544 , Sustainability Consultancy Work Practice, Earth and Environmental Sciences 
ENVS8990 , Environmental Sciences, Earth and Environmental Sciences 
FOAR1000 , Indigenous Cultural Exchange,Owned at Faculty level 
FOAR1001 , Indigenous Research Project,Owned at Faculty level 
FOAR7000 , Research Paradigms,Owned at Faculty level 
FOAR7001 , Research Communications,Owned at Faculty level 
FOAR7002 , Research Frontiers,Owned at Faculty level 
FOAR7003 , Digital Literacies for Researchers,Owned at Faculty level 
FOAR7004 , Arts Internship for Researchers,Owned at Faculty level 
FOAR7005 , Research Theme 1: Living in the Anthropocene,Owned at Faculty level 
FOAR7006 ," Research Theme 2: Feminism, Queer Theory and the Problem of Identity",Owned at Faculty level 
FOAR7007 , Research Theme 3: Neoliberalism and Its Discontents,Owned at Faculty level 
FOAR7008 , Research Theme 4: Globalising Cultures,Owned at Faculty level 
FOAR7010 , Research Theme 5: Evolution of Education,Owned at Faculty level 
FOHS3050 , Critical Communication,Owned at Faculty level 
FOHS7000 , Research Frontiers in Human Sciences,Owned at Faculty level 
FOHS7010 , Research Communication in the Human Sciences,Owned at Faculty level 
FOHS7100 , Ethical Issues in Research,Owned at Faculty level 
FOHS7200 , Advanced Topics in Research in the Human Sciences 1,Owned at Faculty level 
FOHS7210 , Advanced Topics in Research in the Human Sciences 2,Owned at Faculty level 
FOHS7220 , Advanced Topics in Research in the Human Sciences 3,Owned at Faculty level 
FOHS7230 , Advanced Topics in Research in the Human Sciences 4,Owned at Faculty level 
FOSE1005 , Mathematical Concepts for Science,Owned at Faculty level 
FOSE1015 , Statistical Concepts for Science,Owned at Faculty level 
FOSE1025 , Scientific Computing,Owned at Faculty level 
FOSE2005 , Global Challenges and STEM,Owned at Faculty level 
FOSE2901 , Advanced STEM II,Owned at Faculty level 
FOSE3000 , Making Science Work for You and Society: Capstone,Owned at Faculty level 
FOSE3005 , Global Challenges Project,Owned at Faculty level 
FOSE3901 , Advanced STEM III,Owned at Faculty level 
FOSE7000 , Research Communications in Science and Engineering,Owned at Faculty level 
FOSE8010 , Leadership in Science Research and Innovation,Owned at Faculty level 
FOSE8020 , Entrepreneurship and Innovation in Science and Technology,Owned at Faculty level 
FOSE8110 , Science Innovation Internship,Owned at Faculty level 
FOSX1015 , Statistical Concepts for Science,Owned at Faculty level 
FOSX1025 , Scientific Computing,Owned at Faculty level 
FREN1000 , French for Travellers," Media, Communications, Creative Arts, Language and Literature "
FREN1010 , I French Studies 1," Media, Communications, Creative Arts, Language and Literature "
FREN1020 , I French Studies 2," Media, Communications, Creative Arts, Language and Literature "
FREN1210 , C French Studies 3," Media, Communications, Creative Arts, Language and Literature "
FREN1220 , C French Studies 4," Media, Communications, Creative Arts, Language and Literature "
FREN2010 , I French Studies 3," Media, Communications, Creative Arts, Language and Literature "
FREN2020 , I French Studies 4," Media, Communications, Creative Arts, Language and Literature "
FREN2210 , C French Studies 5," Media, Communications, Creative Arts, Language and Literature "
FREN2220 , C French Studies 6," Media, Communications, Creative Arts, Language and Literature "
FREN3010 , I French Studies 5," Media, Communications, Creative Arts, Language and Literature "
FREN3020 ,  I FRENCH Studies 6," Media, Communications, Creative Arts, Language and Literature "
GEND1000 , Freedom Dreams: Foundations in Gender Studies, Social Sciences 
GEND1020 , Gender and Power, Social Sciences 
GEND2020 , Modern Families, Social Sciences 
GEND2030 ," Sex, Race, and Rock", Social Sciences 
GEND3010 ," Gender, Crime and Violence", Social Sciences 
GEND3030 , Decolonising Identity, Social Sciences 
GENX1000 , Freedom Dreams: Foundations in Gender Studies, Social Sciences 
GENX2020 , Modern Families, Social Sciences 
GENX3010 ," Gender, Crime and Violence", Social Sciences 
GENX3020 , Modern Families, Social Sciences 
GEOP1010 , Introducing Human Geography, Social Sciences 
GEOP1030 , Sydney and the Great Australian Dream, Social Sciences 
GEOP1040 , Planning Systems, Social Sciences 
GEOP1080 , Urban Planet: Cities and Planning in the Anthropocene, Social Sciences 
GEOP2010 , Theory and Methods in Geography and Planning, Social Sciences 
GEOP2040 , Cities of the Global South , Social Sciences 
GEOP2050 , Environment and Society, Social Sciences 
GEOP2060 , Geography and Planning Field School, Social Sciences 
GEOP2070 ," Urban Dynamics: Population, Housing and Regeneration", Social Sciences 
GEOP2080 , Planning and Development, Social Sciences 
GEOP3000 , Environmental Justice in the Anthropocene, Social Sciences 
GEOP3020 , Disasters and Resilient Communities , Social Sciences 
GEOP3030 ,Making, Social Sciences 
GEOP3070 , Urban Economies, Social Sciences 
GEOP3080 , Urban Strategic Planning, Social Sciences 
GEOP3090 , Thinking Space, Social Sciences 
GEOP3800 , Practicing Geography, Social Sciences 
GEOP4070 , Social Impact Assessment, Social Sciences 
GEOP4080 , Planning Experience, Social Sciences 
GEOP4090 , Planning and Design, Social Sciences 
GEOP6050 , Environment and Society, Social Sciences 
GEOP6070 ," Urban Dynamics: Population, Housing and Regeneration", Social Sciences 
GEOP6080 , Theory and Methods in Geography and Planning, Social Sciences 
GEOP7000 , Dialogues in Geography and Planning, Social Sciences 
GEOP7001 , Approaches in Geography and Planning, Social Sciences 
GEOP8010 , Social Impact Assessment, Social Sciences 
GEOP8050 , Attitudes to the Environment, Social Sciences 
GEOP8060 , Environmental Impact Assessment, Social Sciences 
GEOP8075 ," Planning, Development and Assessment", Social Sciences 
GEOP8080 , Sustainable Urban Regions, Social Sciences 
GEOP8085 , Environmental Decision Making, Social Sciences 
GEOP8090 , Gateway to the Planning Profession, Social Sciences 
GEOP8990 , Geography and Planning, Social Sciences 
GEOS1110 , The Habitable Planet, Earth and Environmental Sciences 
GEOS1130 ," Blue Planet: Oceans, Climate and Life", Earth and Environmental Sciences 
GEOS2130 , Marine Sediments: Records of Past Earth, Earth and Environmental Sciences 
GEOS2311 , Geophysical Methods for Earth and Environmental Sciences, Earth and Environmental Sciences 
GEOS2320 , Planetary Physics, Earth and Environmental Sciences 
GEOS3080 , PACE in Earth and Environmental Sciences, Earth and Environmental Sciences 
GEOS3130 , Earth System History, Earth and Environmental Sciences 
GEOS3136 , Applied Marine Science, Earth and Environmental Sciences 
GEOS3315 , Global Tectonics and Cycles, Earth and Environmental Sciences 
GEOS3910 , Advanced Earth and Environmental Sciences III, Earth and Environmental Sciences 
GEOS7710 , Palaeoenvironments and Biogeochemistry, Earth and Environmental Sciences 
GEOS7711 , Research Topics in Earth and Environmental Sciences , Earth and Environmental Sciences 
GEOS7712 , Advanced Geochemical Applications and Techniques , Earth and Environmental Sciences 
GEOS7721 , Scientific Visualisation and Scripting, Earth and Environmental Sciences 
GEOS7900 , Research Frontiers: Advances in Earth and Environmental Sciences, Earth and Environmental Sciences 
GEOS7901 , Research Methods in Earth and Environmental Sciences, Earth and Environmental Sciences 
GEOS7922 , Advanced Field and Laboratory Techniques, Earth and Environmental Sciences 
GEOS7923 , Literature Project in Earth and Environmental Sciences, Earth and Environmental Sciences 
GEOS8800 , Research Frontiers in Earth and Environmental Sciences, Earth and Environmental Sciences 
GEOS8801 , Research Methods in Earth and Environmental Sciences, Earth and Environmental Sciences 
GEOS8810 , Palaeoenvironments and Biogeochemistry, Earth and Environmental Sciences 
GEOS8811 , Research Topics in Earth and Environmental Sciences, Earth and Environmental Sciences 
GEOS8812 , Advanced Geochemical Applications and Techniques , Earth and Environmental Sciences 
GEOS8821 , Scientific Visualisation and Scripting, Earth and Environmental Sciences 
GEOS8822 , Advanced Field and Laboratory Techniques, Earth and Environmental Sciences 
GEOS8823 , Literature Project in Earth and Environmental Sciences, Earth and Environmental Sciences 
GEOS8990 , Earth and Planetary Science, Earth and Environmental Sciences 
GEOX8010 , Social Impact Assessment, Social Sciences 
GMBA8001 , Know Your People, Management  
GMBA8002 , Know Your Organisation, Management  
GMBA8003 , Adapt Your Leadership Style, Management  
GMBA8004 , Become a Meaning Maker, Management  
GMBA8011 , Be Competitive, Management  
GMBA8012 , Be Global, Management  
GMBA8013 , Be Disruptive, Management  
GMBA8014 , Be Sustainable, Management  
GMBA8021 , Know Your Numbers 1, Accounting and Corporate Governance  
GMBA8022 , Know Your Numbers 2, Applied Finance  
GMBA8023 , Generate Insights, Actuarial Studies and Business Analytics  
GMBA8024 , Know Your Customers, Marketing  
GMBA8031 , Communicate with Impact, Marketing  
GMBA8032 , Manage Change, Management  
GMBA8033 , Negotiate and Resolve Conflict, Management  
GMBA8034 , Engage the Board, Accounting and Corporate Governance  
GMBA8101 ," Your Career, Your Life", Management  
GMBA8102 , Build Personal Resilience, Management  
